{
  "$schema": "./component-inventory.schema.json",
  "schemaVersion": "1.1.0",
  "library": {
    "name": "@kern-ui/angular",
    "version": "0.1.2"
  },
  "generatedBy": "scripts/generate-component-contract.mjs",
  "generatedFrom": [
    "projects/kern/*/src",
    "projects/kern/api/runtime-entrypoints.json",
    "projects/kern/api/lifecycle.json",
    "projects/kern/api/deprecations.json",
    "projects/showcase/src/lib/catalog.ts"
  ],
  "summary": {
    "selectorCount": 150,
    "implementationCount": 139,
    "componentCount": 134,
    "directiveCount": 5,
    "catalogEntryCount": 132,
    "catalogReviewUnitCount": 127,
    "catalogAliasEntryCount": 5,
    "publicReviewUnitCount": 136,
    "supportingReviewUnitCount": 9,
    "internalImplementationCount": 3,
    "selectorAliasCount": 11
  },
  "units": [
    {
      "reviewUnit": "core:KrnThemeDirective",
      "symbol": "KrnThemeDirective",
      "kind": "directive",
      "entrypoint": "core",
      "importPath": "@kern-ui/angular/core",
      "family": "core",
      "source": "projects/kern/core/src/lib/core/theme.ts",
      "visibility": "public",
      "role": "supporting",
      "reviewWith": null,
      "lifecycle": {
        "status": "stable",
        "owner": "kern/core"
      },
      "canonicalPublicSymbol": "KrnThemeDirective",
      "canonicalSelector": "[krnTheme]",
      "publicSymbols": ["KrnThemeDirective"],
      "selectors": ["[krnTheme]"],
      "selectorDeprecations": [],
      "catalog": [],
      "aliases": {
        "symbols": [],
        "selectors": [],
        "catalogIds": []
      }
    },
    {
      "reviewUnit": "core:KrnIcon",
      "symbol": "KrnIcon",
      "kind": "component",
      "entrypoint": "core",
      "importPath": "@kern-ui/angular/core",
      "family": "foundations",
      "source": "projects/kern/core/src/lib/foundations/icon.ts",
      "visibility": "public",
      "role": "supporting",
      "reviewWith": null,
      "lifecycle": {
        "status": "stable",
        "owner": "kern/core"
      },
      "canonicalPublicSymbol": "KrnIcon",
      "canonicalSelector": "krn-icon",
      "publicSymbols": ["KrnIcon"],
      "selectors": ["krn-icon"],
      "selectorDeprecations": [],
      "catalog": [],
      "aliases": {
        "symbols": [],
        "selectors": [],
        "catalogIds": []
      }
    },
    {
      "reviewUnit": "actions:KrnButton",
      "symbol": "KrnButton",
      "kind": "component",
      "entrypoint": "actions",
      "importPath": "@kern-ui/angular/actions",
      "family": "actions",
      "source": "projects/kern/actions/src/lib/actions/button.ts",
      "visibility": "public",
      "role": "catalog",
      "reviewWith": null,
      "lifecycle": {
        "status": "stable",
        "owner": "kern/actions"
      },
      "canonicalPublicSymbol": "KrnButton",
      "canonicalSelector": "button[krnButton]",
      "publicSymbols": ["KrnButton"],
      "selectors": ["button[krnButton]"],
      "selectorDeprecations": [],
      "catalog": [
        {
          "id": "button",
          "name": "Button",
          "category": "Actions",
          "selector": "button[krnButton]",
          "variantOf": null,
          "status": "stable",
          "owner": "kern/actions",
          "evidenceProfile": "stable-release"
        }
      ],
      "aliases": {
        "symbols": [],
        "selectors": [],
        "catalogIds": []
      }
    },
    {
      "reviewUnit": "actions:KrnIconButton",
      "symbol": "KrnIconButton",
      "kind": "component",
      "entrypoint": "actions",
      "importPath": "@kern-ui/angular/actions",
      "family": "actions",
      "source": "projects/kern/actions/src/lib/actions/icon-button.ts",
      "visibility": "public",
      "role": "catalog",
      "reviewWith": null,
      "lifecycle": {
        "status": "stable",
        "owner": "kern/actions"
      },
      "canonicalPublicSymbol": "KrnIconButton",
      "canonicalSelector": "button[krnIconButton]",
      "publicSymbols": ["KrnIconButton"],
      "selectors": ["button[krnIconButton]"],
      "selectorDeprecations": [],
      "catalog": [
        {
          "id": "icon-button",
          "name": "Icon Button",
          "category": "Actions",
          "selector": "button[krnIconButton]",
          "variantOf": null,
          "status": "stable",
          "owner": "kern/actions",
          "evidenceProfile": "stable-release"
        }
      ],
      "aliases": {
        "symbols": [],
        "selectors": [],
        "catalogIds": []
      }
    },
    {
      "reviewUnit": "actions:KrnButtonGroup",
      "symbol": "KrnButtonGroup",
      "kind": "component",
      "entrypoint": "actions",
      "importPath": "@kern-ui/angular/actions",
      "family": "actions",
      "source": "projects/kern/actions/src/lib/actions/button-group.ts",
      "visibility": "public",
      "role": "catalog",
      "reviewWith": null,
      "lifecycle": {
        "status": "stable",
        "owner": "kern/actions"
      },
      "canonicalPublicSymbol": "KrnButtonGroup",
      "canonicalSelector": "div[krnButtonGroup]",
      "publicSymbols": ["KrnButtonGroup"],
      "selectors": ["div[krnButtonGroup]"],
      "selectorDeprecations": [],
      "catalog": [
        {
          "id": "button-group",
          "name": "Button Group",
          "category": "Actions",
          "selector": "div[krnButtonGroup]",
          "variantOf": null,
          "status": "stable",
          "owner": "kern/actions",
          "evidenceProfile": "stable-release"
        }
      ],
      "aliases": {
        "symbols": [],
        "selectors": [],
        "catalogIds": []
      }
    },
    {
      "reviewUnit": "actions:KrnSplitButton",
      "symbol": "KrnSplitButton",
      "kind": "component",
      "entrypoint": "actions",
      "importPath": "@kern-ui/angular/actions",
      "family": "actions",
      "source": "projects/kern/actions/src/lib/actions/dropdown-button.ts",
      "visibility": "public",
      "role": "catalog",
      "reviewWith": null,
      "lifecycle": {
        "status": "stable",
        "owner": "kern/actions"
      },
      "canonicalPublicSymbol": "KrnSplitButton",
      "canonicalSelector": "krn-split-button",
      "publicSymbols": ["KrnSplitButton"],
      "selectors": ["krn-split-button"],
      "selectorDeprecations": [],
      "catalog": [
        {
          "id": "split-button",
          "name": "Split Button",
          "category": "Actions",
          "selector": "krn-split-button",
          "variantOf": null,
          "status": "stable",
          "owner": "kern/actions",
          "evidenceProfile": "stable-release"
        }
      ],
      "aliases": {
        "symbols": [],
        "selectors": [],
        "catalogIds": []
      }
    },
    {
      "reviewUnit": "actions:KrnFloatingActionButton",
      "symbol": "KrnFloatingActionButton",
      "kind": "component",
      "entrypoint": "actions",
      "importPath": "@kern-ui/angular/actions",
      "family": "actions",
      "source": "projects/kern/actions/src/lib/actions/button.ts",
      "visibility": "public",
      "role": "catalog",
      "reviewWith": null,
      "lifecycle": {
        "status": "stable",
        "owner": "kern/actions"
      },
      "canonicalPublicSymbol": "KrnFloatingActionButton",
      "canonicalSelector": "button[krnFab]",
      "publicSymbols": ["KrnFloatingActionButton"],
      "selectors": ["button[krnFab]"],
      "selectorDeprecations": [],
      "catalog": [
        {
          "id": "floating-action-button",
          "name": "Floating Action Button",
          "category": "Actions",
          "selector": "button[krnFab]",
          "variantOf": null,
          "status": "stable",
          "owner": "kern/actions",
          "evidenceProfile": "stable-release"
        }
      ],
      "aliases": {
        "symbols": [],
        "selectors": [],
        "catalogIds": []
      }
    },
    {
      "reviewUnit": "actions:KrnToggleButton",
      "symbol": "KrnToggleButton",
      "kind": "component",
      "entrypoint": "actions",
      "importPath": "@kern-ui/angular/actions",
      "family": "actions",
      "source": "projects/kern/actions/src/lib/actions/toggle-button.ts",
      "visibility": "public",
      "role": "catalog",
      "reviewWith": null,
      "lifecycle": {
        "status": "stable",
        "owner": "kern/actions"
      },
      "canonicalPublicSymbol": "KrnToggleButton",
      "canonicalSelector": "button[krnToggleButton]",
      "publicSymbols": ["KrnToggleButton"],
      "selectors": ["button[krnToggleButton]"],
      "selectorDeprecations": [],
      "catalog": [
        {
          "id": "toggle-button",
          "name": "Toggle Button",
          "category": "Actions",
          "selector": "button[krnToggleButton]",
          "variantOf": null,
          "status": "stable",
          "owner": "kern/actions",
          "evidenceProfile": "stable-release"
        }
      ],
      "aliases": {
        "symbols": [],
        "selectors": [],
        "catalogIds": []
      }
    },
    {
      "reviewUnit": "actions:KrnToggleGroup",
      "symbol": "KrnToggleGroup",
      "kind": "component",
      "entrypoint": "actions",
      "importPath": "@kern-ui/angular/actions",
      "family": "actions",
      "source": "projects/kern/actions/src/lib/actions/toggle-group.ts",
      "visibility": "public",
      "role": "catalog",
      "reviewWith": null,
      "lifecycle": {
        "status": "stable",
        "owner": "kern/actions"
      },
      "canonicalPublicSymbol": "KrnToggleGroup",
      "canonicalSelector": "div[krnToggleGroup]",
      "publicSymbols": ["KrnToggleGroup"],
      "selectors": ["div[krnToggleGroup]"],
      "selectorDeprecations": [],
      "catalog": [
        {
          "id": "toggle-group",
          "name": "Toggle Group",
          "category": "Actions",
          "selector": "div[krnToggleGroup]",
          "variantOf": null,